{
  "schemaVersion": "3.0",
  "project": {
    "name": "Sample Tower",
    "code": "ST",
    "config": {
      "referenceDiscipline": "arc",
      "namingPatterns": {
        "model": "{ProjectCode}-{DisciplineCode}-{ModelCode}, לדוגמה ST-STR-SUP",
        "sheet": "{ProjectCode}-{DisciplineCode}-{SheetType}-{'{'}NNN{'}'}, לדוגמה ST-STR-P-001"
      },
      "expectedWorksets": [
        "01_Shared Levels and Grids",
        "02_{Discipline}_Model",
        "03_Links"
      ],
      "expectedLinksByDiscipline": {
        "arc": [],
        "str": [
          "arc"
        ],
        "hvac": [
          "arc",
          "str"
        ],
        "elec": [
          "arc",
          "str"
        ],
        "plumb": [
          "arc",
          "str"
        ],
        "land": [
          "arc"
        ]
      }
    }
  },
  "roles": [
    {
      "id": "bim_manager",
      "label": "מנהל BIM",
      "description": "רואה את כל הדיספלינות בפירוט מלא.",
      "scope": "project",
      "detail": "full"
    },
    {
      "id": "systems_coordinator",
      "label": "מתאם מערכות",
      "description": "רואה את כל הדיספלינות, אך רק בדיקות קואורדינציה.",
      "scope": "project",
      "detail": "coordination"
    },
    {
      "id": "project_manager",
      "label": "מנהל פרויקט",
      "description": "רואה ציונים וסטטוס בלבד, ללא פירוט בדיקות.",
      "scope": "project",
      "detail": "summary"
    },
    {
      "id": "designer",
      "label": "מתכנן",
      "description": "רואה רק את הדיספלינה שלו, בפירוט מלא.",
      "scope": "own_discipline",
      "detail": "full"
    }
  ],
  "checkDefinitions": [
    {
      "id": "acc_access",
      "label": "גישה למתכנן ב-ACC/FORMA",
      "category": "קואורדינציה והקמה",
      "categoryGroup": "coordination",
      "unit": "bool",
      "higherIsBetter": true,
      "status": "coming_soon"
    },
    {
      "id": "cloud_model_exists",
      "label": "המודל קיים בענן (ACC/FORMA)",
      "category": "קואורדינציה והקמה",
      "categoryGroup": "coordination",
      "unit": "bool",
      "higherIsBetter": true,
      "status": "coming_soon"
    },
    {
      "id": "all_models_in_cloud",
      "label": "כלל מודלי הדיספלינה הוקמו בענן",
      "category": "קואורדינציה והקמה",
      "categoryGroup": "coordination",
      "unit": "bool",
      "higherIsBetter": true,
      "status": "coming_soon"
    },
    {
      "id": "naming_convention_model",
      "label": "שם המודל עומד בתקן הקידוד",
      "category": "קואורדינציה והקמה",
      "categoryGroup": "coordination",
      "unit": "bool",
      "higherIsBetter": true,
      "status": "available",
      "goodMin": 1,
      "warnMin": 1,
      "critMin": 1
    },
    {
      "id": "coordinates_acquired",
      "label": "נרכשו קואורדינטות ממודל הייחוס",
      "category": "קואורדינציה והקמה",
      "categoryGroup": "coordination",
      "unit": "bool",
      "higherIsBetter": true,
      "status": "available",
      "goodMin": 1,
      "warnMin": 1,
      "critMin": 1,
      "excludeReference": true
    },
    {
      "id": "copy_monitor_levels",
      "label": "בוצע Copy/Monitor למפלסים",
      "category": "קואורדינציה והקמה",
      "categoryGroup": "coordination",
      "unit": "bool",
      "higherIsBetter": true,
      "status": "available",
      "goodMin": 1,
      "warnMin": 1,
      "critMin": 1,
      "excludeReference": true
    },
    {
      "id": "levels_match",
      "label": "מפלסים זהים (כמות/שם/גובה) למודל הייחוס",
      "category": "קואורדינציה והקמה",
      "categoryGroup": "coordination",
      "unit": "bool",
      "higherIsBetter": true,
      "status": "available",
      "goodMin": 1,
      "warnMin": 1,
      "critMin": 1,
      "excludeReference": true
    },
    {
      "id": "copy_monitor_grids",
      "label": "בוצע Copy/Monitor לצירים",
      "category": "קואורדינציה והקמה",
      "categoryGroup": "coordination",
      "unit": "bool",
      "higherIsBetter": true,
      "status": "available",
      "goodMin": 1,
      "warnMin": 1,
      "critMin": 1,
      "excludeReference": true
    },
    {
      "id": "grids_match",
      "label": "צירים זהים (כמות/שם) למודל הייחוס",
      "category": "קואורדינציה והקמה",
      "categoryGroup": "coordination",
      "unit": "bool",
      "higherIsBetter": true,
      "status": "available",
      "goodMin": 1,
      "warnMin": 1,
      "critMin": 1,
      "excludeReference": true
    },
    {
      "id": "worksets_per_bep",
      "label": "Worksets הוקמו לפי ה-BEP",
      "category": "קואורדינציה והקמה",
      "categoryGroup": "coordination",
      "unit": "bool",
      "higherIsBetter": true,
      "status": "available",
      "goodMin": 1,
      "warnMin": 1,
      "critMin": 1
    },
    {
      "id": "all_links_loaded",
      "label": "כל מודלי הדיספלינות הרלוונטיות טעונים כ-Links",
      "category": "קואורדינציה והקמה",
      "categoryGroup": "coordination",
      "unit": "bool",
      "higherIsBetter": true,
      "status": "available",
      "goodMin": 1,
      "warnMin": 1,
      "critMin": 1
    },
    {
      "id": "links_correct_workset",
      "label": "ה-Links ממוקמים ב-Workset הנכון",
      "category": "קואורדינציה והקמה",
      "categoryGroup": "coordination",
      "unit": "bool",
      "higherIsBetter": true,
      "status": "available",
      "goodMin": 1,
      "warnMin": 1,
      "critMin": 1
    },
    {
      "id": "shared_coordinates",
      "label": "המודל במערכת הקואורדינטות המשותפת (Shared Site)",
      "category": "קואורדינציה והקמה",
      "categoryGroup": "coordination",
      "unit": "bool",
      "higherIsBetter": true,
      "status": "available",
      "goodMin": 1,
      "warnMin": 1,
      "critMin": 1
    },
    {
      "id": "base_point_integrity",
      "label": "Project Base Point / Survey Point לא הוזזו",
      "category": "קואורדינציה והקמה",
      "categoryGroup": "coordination",
      "unit": "bool",
      "higherIsBetter": true,
      "status": "available",
      "goodMin": 1,
      "warnMin": 1,
      "critMin": 1
    },
    {
      "id": "units_consistency",
      "label": "יחידות המודל תואמות לתקן הפרויקט",
      "category": "קואורדינציה והקמה",
      "categoryGroup": "coordination",
      "unit": "bool",
      "higherIsBetter": true,
      "status": "available",
      "goodMin": 1,
      "warnMin": 1,
      "critMin": 1
    },
    {
      "id": "modeling_progress_pct",
      "label": "היקף התקדמות מידול",
      "category": "התקדמות מידול",
      "categoryGroup": "modeling",
      "unit": "%",
      "higherIsBetter": true,
      "status": "available",
      "goodMin": 40,
      "warnMin": 15,
      "critMin": 1
    },
    {
      "id": "duplicate_elements",
      "label": "אלמנטים כפולים / חופפים",
      "category": "התקדמות מידול",
      "categoryGroup": "modeling",
      "unit": "count",
      "higherIsBetter": false,
      "status": "available",
      "goodMax": 0,
      "warnMax": 3,
      "critMax": 10
    },
    {
      "id": "sync_recency_days",
      "label": "ימים מאז Sync אחרון",
      "category": "התקדמות מידול",
      "categoryGroup": "modeling",
      "unit": "days",
      "higherIsBetter": false,
      "status": "available",
      "goodMax": 1,
      "warnMax": 3,
      "critMax": 7
    },
    {
      "id": "worksharing_display_name",
      "label": "Worksharing Display Name מוגדר",
      "category": "התקדמות מידול",
      "categoryGroup": "modeling",
      "unit": "bool",
      "higherIsBetter": true,
      "status": "available",
      "goodMin": 1,
      "warnMin": 1,
      "critMin": 1
    },
    {
      "id": "warnings",
      "label": "Warnings",
      "category": "Model Cleanliness",
      "categoryGroup": "modeling",
      "unit": "count",
      "higherIsBetter": false,
      "status": "available",
      "goodMax": 30,
      "warnMax": 80,
      "critMax": 160
    },
    {
      "id": "workset1_elements",
      "label": "Elements on Workset1/Default",
      "category": "Worksharing",
      "categoryGroup": "modeling",
      "unit": "count",
      "higherIsBetter": false,
      "status": "available",
      "goodMax": 0,
      "warnMax": 15,
      "critMax": 40
    },
    {
      "id": "unplaced_rooms",
      "label": "Unplaced / Unenclosed Rooms",
      "category": "Rooms & Spaces",
      "categoryGroup": "modeling",
      "unit": "count",
      "higherIsBetter": false,
      "status": "available",
      "goodMax": 0,
      "warnMax": 5,
      "critMax": 15
    },
    {
      "id": "duplicate_types",
      "label": "Duplicate-Named Family Types",
      "category": "Families",
      "categoryGroup": "modeling",
      "unit": "count",
      "higherIsBetter": false,
      "status": "available",
      "goodMax": 0,
      "warnMax": 3,
      "critMax": 10
    },
    {
      "id": "view_template_coverage",
      "label": "View Template Coverage",
      "category": "Views & Sheets",
      "categoryGroup": "modeling",
      "unit": "%",
      "higherIsBetter": true,
      "status": "available",
      "goodMin": 90,
      "warnMin": 70,
      "critMin": 40
    },
    {
      "id": "views_not_on_sheets",
      "label": "Views Not Placed on Sheets",
      "category": "Views & Sheets",
      "categoryGroup": "modeling",
      "unit": "count",
      "higherIsBetter": false,
      "status": "available",
      "goodMax": 5,
      "warnMax": 20,
      "critMax": 50
    },
    {
      "id": "model_groups",
      "label": "Model Groups",
      "category": "Model Cleanliness",
      "categoryGroup": "modeling",
      "unit": "count",
      "higherIsBetter": false,
      "status": "available",
      "goodMax": 5,
      "warnMax": 15,
      "critMax": 30
    },
    {
      "id": "sheet_naming_compliance",
      "label": "גיליונות עומדים בתקן הקידוד",
      "category": "תיעוד",
      "categoryGroup": "documentation",
      "unit": "%",
      "higherIsBetter": true,
      "status": "available",
      "goodMin": 95,
      "warnMin": 80,
      "critMin": 50
    },
    {
      "id": "file_size_mb",